{
  "name": "chrome-devtools",
  "description": "MCP server for Chrome DevTools Protocol - inspect, debug, and interact with Chrome browser pages",
  "author": {
    "name": "wow-look-at-my-code"
  },
  "keywords": ["chrome", "devtools", "browser", "debugging", "mcp"],
  "mcpServers": "./.mcp.json",
  "mh": {
    "include_in_marketplace": true
  }
}
