{
	"$schema": "../../example-plugin/.claude-plugin/plugin.schema.json",
	"name": "edits-through-tools",
	"description": "Refuses every route that changes file content under the working tree without going through Write, Edit or NotebookEdit - sed -i and the other in-place editors, redirects, tee, cp/mv/install/rsync, patch and git apply, git used as an editor and the plumbing that skips the worktree, extraction and downloads into the tree, symlinks over tracked paths, shell indirection it follows into scripts and aliases, plus the server-side GitHub commit and the subagent grant that would sidestep all of it",
	"author": {
		"name": "mhaynie"
	},
	"keywords": ["guard", "hook", "pretooluse", "worktree", "edit", "write", "sed", "redirect", "patch", "git", "provenance"],
	"hooks": {
		"PreToolUse": [
			{
				"matcher": "*",
				"hooks": [
					{
						"type": "command",
						"command": "${CLAUDE_PLUGIN_ROOT}/build/edits-through-tools"
					}
				]
			}
		]
	},
	"mh": {
		"include_in_marketplace": true
	}
}
