{
	"$schema": "../../example-plugin/.claude-plugin/plugin.schema.json",
	"name": "no-tombstones",
	"description": "Strips a tombstone comment out of a write -- prose about a state the code is no longer in, or an argument aimed at whoever reviews the diff. A finding that cannot be cleanly excised still gets the write refused",
	"author": {
		"name": "mhaynie"
	},
	"keywords": ["comments", "documentation", "staleness", "narration", "pretooluse", "hook", "enforcement"],
	"hooks": {
		"PreToolUse": [
			{
				"matcher": "*",
				"hooks": [
					{
						"type": "command",
						"command": "${CLAUDE_PLUGIN_ROOT}/build/no-tombstones"
					}
				]
			}
		]
	},
	"mh": {
		"include_in_marketplace": true
	}
}
