{
	"$schema": "../../example-plugin/.claude-plugin/plugin.schema.json",
	"name": "no-work-loss",
	"description": "Refuses the two ways a session loses authorship of the working tree: any command that would destroy content existing only there (reset --hard, checkout/switch onto a dirty tree, clean, restore, stash drop/clear, force push, rm/mv/tee/truncate/> aimed at a modified or untracked file), and any change to file content that skips Write/Edit/NotebookEdit (sed -i and the other in-place editors, redirects, tee, mv/install/rsync, patch and git apply, git used as an editor, extraction and downloads into the tree, symlinks over tracked paths, shell indirection it follows into scripts and aliases, the server-side GitHub commit, and the subagent grant that would sidestep all of it)",
	"author": {
		"name": "mhaynie"
	},
	"keywords": ["git", "guard", "hook", "pretooluse", "uncommitted", "worktree", "reset", "checkout", "clean", "stash", "force-push", "data-loss", "edit", "write", "sed", "redirect", "patch", "provenance"],
	"hooks": {
		"PreToolUse": [
			{
				"matcher": "*",
				"hooks": [
					{
						"type": "command",
						"command": "${CLAUDE_PLUGIN_ROOT}/build/no-work-loss"
					}
				]
			}
		]
	},
	"mh": {
		"include_in_marketplace": true
	}
}
