{
  "name": "slh-workers",
  "description": "Delegate implementation to slh workers on a fast model over MCP, with Claude as the planner, coordinator and reviewer. Installs slh from buildhost at first use.",
  "author": {
    "name": "wow-look-at-my-code"
  },
  "keywords": ["slh", "subagent", "delegate", "workers", "mcp", "coordinator"],
  "mcpServers": "./.mcp.json",
  "mh": {
    "include_in_marketplace": true
  }
}
