{
  "name": "glob",
  "description": "Restores the builtin Glob tool that Claude Code removed in 2.1.117: ripgrep-backed file pattern matching with byte-for-byte 2.1.116 behavior",
  "author": {
    "name": "wow-look-at-my-code"
  },
  "keywords": ["glob", "search", "files", "ripgrep", "mcp", "builtin"],
  "mcpServers": "./.mcp.json",
  "mh": {
    "include_in_marketplace": true
  }
}
